root@lamp-ubuntu-s-1vcpu-1gb-tor1-01:~# tcpdump -c 5 -i eth0
tcpdump: verbose output suppressed, use -v or -vv for full protocol decode
listening on eth0, link-type EN10MB (Ethernet), capture size 262144 bytes
21:36:06.717557 IP 134.122.47.164.ssh > cpe589630e09368-cm589630e09366.cpe.net.cable.rogers.com.50413: Flags [P.], seq 2115541273:2115541381, ack 972770227, win 501, length 108
21:36:06.717620 IP 134.122.47.164.ssh > cpe589630e09368-cm589630e09366.cpe.net.cable.rogers.com.50413: Flags [P.], seq 108:144, ack 1, win 501, length 36
21:36:06.717683 IP 134.122.47.164.ssh > cpe589630e09368-cm589630e09366.cpe.net.cable.rogers.com.50413: Flags [P.], seq 144:252, ack 1, win 501, length 108
21:36:06.717726 IP 134.122.47.164.ssh > cpe589630e09368-cm589630e09366.cpe.net.cable.rogers.com.50413: Flags [P.], seq 252:288, ack 1, win 501, length 36
21:36:06.718148 IP 134.122.47.164.44192 > dns.google.domain: 59439+ PTR? 183.145.229.99.in-addr.arpa. (45)
5 packets captured
16 packets received by filter
0 packets dropped by kernel
root@lamp-ubuntu-s-1vcpu-1gb-tor1-01:~#
