root@lamp-ubuntu-s-1vcpu-1gb-tor1-01:~# tcpdump -r 0001.pcap
reading from file 0001.pcap, link-type EN10MB (Ethernet)
21:40:23.185493 IP 134.122.47.164.ssh > cpe589630e09368-cm589630e09366.cpe.net.cable.rogers.com.50413: Flags [P.], seq 2140442969:2140443013, ack 972784347, win 501, length 44
21:40:23.185588 IP 134.122.47.164.ssh > cpe589630e09368-cm589630e09366.cpe.net.cable.rogers.com.50413: Flags [P.], seq 44:152, ack 1, win 501, length 108
21:40:23.185632 IP 134.122.47.164.ssh > cpe589630e09368-cm589630e09366.cpe.net.cable.rogers.com.50413: Flags [P.], seq 152:188, ack 1, win 501, length 36
21:40:23.200187 IP cpe589630e09368-cm589630e09366.cpe.net.cable.rogers.com.50413 > 134.122.47.164.ssh: Flags [.], ack 188, win 6203, length 0
21:40:30.293719 IP scanner-03.ch1.censys-scanner.com.8932 > 134.122.47.164.ipp: Flags [S], seq 3527512522, win 1024, options [mss 1460], length 0
21:40:31.545311 IP cpe589630e09368-cm589630e09366.cpe.net.cable.rogers.com.50413 > 134.122.47.164.ssh: Flags [P.], seq 1:69, ack 188, win 6203, length 68
21:40:31.545365 IP 134.122.47.164.ssh > cpe589630e09368-cm589630e09366.cpe.net.cable.rogers.com.50413: Flags [.], ack 69, win 501, length 0
21:40:36.465613 IP 178-137-165-16.broadband.kyivstar.net.57134 > 134.122.47.164.3486: Flags [S], seq 305559899, win 1024, length 0
21:40:41.872460 IP 185.220.205.106.48230 > 134.122.47.164.9998: Flags [S], seq 1507517927, win 65535, length 0
21:40:42.172519 IP cpe589630e09368-cm589630e09366.cpe.net.cable.rogers.com.50413 > 134.122.47.164.ssh: Flags [P.], seq 69:105, ack 188, win 6203, length 36
21:40:42.172560 IP 134.122.47.164.ssh > cpe589630e09368-cm589630e09366.cpe.net.cable.rogers.com.50413: Flags [.], ack 105, win 501, length 0
21:40:42.172740 IP 134.122.47.164.ssh > cpe589630e09368-cm589630e09366.cpe.net.cable.rogers.com.50413: Flags [P.], seq 188:224, ack 105, win 501, length 36
21:40:42.224605 IP cpe589630e09368-cm589630e09366.cpe.net.cable.rogers.com.50413 > 134.122.47.164.ssh: Flags [.], ack 224, win 6203, length 0
21:40:42.645636 IP cpe589630e09368-cm589630e09366.cpe.net.cable.rogers.com.50413 > 134.122.47.164.ssh: Flags [P.], seq 105:141, ack 224, win 6203, length 36
21:40:42.645846 IP 134.122.47.164.ssh > cpe589630e09368-cm589630e09366.cpe.net.cable.rogers.com.50413: Flags [P.], seq 224:260, ack 141, win 501, length 36
21:40:42.709067 IP cpe589630e09368-cm589630e09366.cpe.net.cable.rogers.com.50413 > 134.122.47.164.ssh: Flags [.], ack 260, win 6203, length 0
21:40:43.035755 IP cpe589630e09368-cm589630e09366.cpe.net.cable.rogers.com.50413 > 134.122.47.164.ssh: Flags [P.], seq 141:177, ack 260, win 6203, length 36
21:40:43.085568 IP 134.122.47.164.ssh > cpe589630e09368-cm589630e09366.cpe.net.cable.rogers.com.50413: Flags [.], ack 177, win 501, length 0
21:40:43.222890 IP cpe589630e09368-cm589630e09366.cpe.net.cable.rogers.com.50413 > 134.122.47.164.ssh: Flags [P.], seq 177:213, ack 260, win 6203, length 36
21:40:43.222937 IP 134.122.47.164.ssh > cpe589630e09368-cm589630e09366.cpe.net.cable.rogers.com.50413: Flags [.], ack 213, win 501, length 0
21:40:43.255535 IP 61.177.173.10.12470 > 134.122.47.164.ssh: Flags [S], seq 3839649605, win 29200, options [mss 1460,sackOK,TS val 138914761 ecr 0,nop,wscale 7], length 0
21:40:43.255586 IP 134.122.47.164 > 61.177.173.10: ICMP 134.122.47.164 tcp port ssh unreachable, length 68
21:40:43.473002 IP 61.177.173.10.14160 > 134.122.47.164.ssh: Flags [S], seq 429225859, win 29200, options [mss 1460,sackOK,TS val 138914814 ecr 0,nop,wscale 7], length 0
21:40:43.473071 IP 134.122.47.164 > 61.177.173.10: ICMP 134.122.47.164 tcp port ssh unreachable, length 68
root@lamp-ubuntu-s-1vcpu-1gb-tor1-01:~# ^C
